[
  {
    "id": "espn-soccer-squad",
    "name": "ESPN Soccer Team Squad",
    "name_cn": "ESPN 球队名单",
    "url": "https://www.espn.com/soccer/team/squad/_/id/{team_id}/{slug}",
    "type": "server-rendered-html",
    "accessibility": {
      "status": "verified-working",
      "last_verified": "2026-05-20",
      "verified_by": "qypvip",
      "notes": "服务端渲染HTML表格，可直接curl/wget获取。无需Cookie。已验证22支球队可提取完整26人大名单。"
    },
    "method": {
      "recommended": "curl",
      "auth_required": false,
      "rate_limit": "无明显限流",
      "encoding": "utf-8",
      "user_agent_required": true
    },
    "response": {
      "format": "html",
      "structure_hint": "Table with class 'Table__TR' rows; columns: Name, Position(Pos), Age, Apps, Goals"
    },
    "domains": [
      "football",
      "sports-tournament"
    ],
    "known_issues": [
      "阿根廷/英格兰等顶级强队页面可能包含预备队（显示超过26人）",
      "ESPN更新可能比官方晚1-2天",
      "不同球队的team_id不同，需要先发现（搜索或遍历）"
    ],
    "alternatives": [
      "dongqiudi-mobile-api",
      "fifa-official-squad"
    ],
    "examples": [
      {
        "url": "https://www.espn.com/soccer/team/squad/_/id/478/france",
        "description": "🇫🇷 法国队26人名单"
      },
      {
        "url": "https://www.espn.com/soccer/team/squad/_/id/205/brazil",
        "description": "🇧🇷 巴西队名单"
      },
      {
        "url": "https://www.espn.com/soccer/team/squad/_/id/448/england",
        "description": "🏴󠁧󠁢󠁥󠁮󠁧󠁿 英格兰名单（含预备队35人）"
      }
    ]
  },
  {
    "id": "dongqiudi-mobile-api",
    "name": "Dongqiudi Mobile API",
    "name_cn": "懂球帝移动端 API",
    "url": "https://api.dongqiudi.com/app/tabs/android/1.json",
    "type": "mobile-api",
    "accessibility": {
      "status": "verified-working",
      "last_verified": "2026-05-20",
      "verified_by": "qypvip",
      "notes": "移动端API开放无认证，返回结构化JSON。桌面网站是React SPA不可直接提取。"
    },
    "method": {
      "recommended": "curl",
      "auth_required": false,
      "rate_limit": "每分钟约30次",
      "encoding": "utf-8",
      "user_agent_required": true
    },
    "response": {
      "format": "json",
      "structure_hint": "articles[] 和 recommend[] 数组，含 id, title, description, share, secondary_category, published_at"
    },
    "domains": [
      "football",
      "sports-tournament"
    ],
    "known_issues": [
      "Search API 返回403（不可用于搜索）",
      "只能用 Feed 流关键词过滤",
      "文章正文需要 browser_navigate 到 desktop article URL 读取（JS渲染但accessibility tree可读）"
    ],
    "alternatives": [
      "espn-soccer-squad"
    ],
    "examples": [
      {
        "url": "https://api.dongqiudi.com/app/tabs/android/1.json?mark=gif&version=74",
        "description": "Feed API 返回最新文章列表"
      },
      {
        "url": "https://www.dongqiudi.com/article/{id}",
        "description": "文章详情页（需browser_navigate）"
      }
    ]
  },
  {
    "id": "tencent-finance-api",
    "name": "Tencent Finance API",
    "name_cn": "腾讯财经行情 API",
    "url": "https://qt.gtimg.cn/q=",
    "type": "json-api",
    "accessibility": {
      "status": "verified-working",
      "last_verified": "2026-05-20",
      "verified_by": "qypvip",
      "notes": "稳定可靠的A股实时行情API，返回GBK编码的文本格式。支持多股票批量查询。"
    },
    "method": {
      "recommended": "curl",
      "auth_required": false,
      "rate_limit": "无明显限流，支持批量查询",
      "encoding": "gbk",
      "user_agent_required": false
    },
    "response": {
      "format": "plain-text",
      "structure_hint": "v_X_sh{code}~{name}~{code}~{price}~...格式，~分割字段"
    },
    "domains": [
      "stock"
    ],
    "known_issues": [
      "返回格式是自定义文本（非标准JSON），需按~分割解析",
      "GBK编码，Python需 .decode('gbk')",
      "非交易时段涨跌幅为0",
      "股票代码前缀规则：sh=6/9开头, sz=0/3开头, bj=其他"
    ],
    "alternatives": [
      "efinance-package",
      "sina-finance-api"
    ],
    "examples": [
      {
        "url": "https://qt.gtimg.cn/q=sh000001,sz000001",
        "description": "批量查询上证指数+平安银行"
      },
      {
        "url": "https://qt.gtimg.cn/q=sh600519",
        "description": "查询贵州茅台"
      }
    ]
  },
  {
    "id": "tencent-finance-historical",
    "name": "Tencent Finance Historical K-Line",
    "name_cn": "腾讯财经历史K线 API",
    "url": "http://web.ifzq.gtimg.cn/appstock/app/fqkline/get",
    "type": "json-api",
    "accessibility": {
      "status": "verified-working",
      "last_verified": "2026-05-20",
      "verified_by": "qypvip",
      "notes": "稳定可靠的历史K线API，支持前复权。efinance的替代方案。"
    },
    "method": {
      "recommended": "curl",
      "auth_required": false,
      "rate_limit": "无明显限流",
      "encoding": "utf-8",
      "user_agent_required": false
    },
    "response": {
      "format": "json",
      "structure_hint": "data[code]['qfqday'] 或 ['day'] → [[date, open, close, high, low, volume], ...]"
    },
    "domains": [
      "stock"
    ],
    "known_issues": [
      "最多返回120天数据",
      "参数格式：?param={prefix}{code},day,,,{days},qfq"
    ],
    "alternatives": [
      "efinance-package"
    ],
    "examples": [
      {
        "url": "http://web.ifzq.gtimg.cn/appstock/app/fqkline/get?param=sh000001,day,,,120,qfq",
        "description": "上证指数120日K线"
      }
    ]
  },
  {
    "id": "efinance-package",
    "name": "Efinance Python Package",
    "name_cn": "Efinance Python 包",
    "url": "https://github.com/Micro-sheep/efinance",
    "type": "json-api",
    "accessibility": {
      "status": "partial",
      "last_verified": "2026-05-25",
      "verified_by": "qypvip",
      "notes": "get_realtime_quotes() 可用，get_quote_history() 可能被东方财富 push2his.eastmoney.com 限流（RemoteDisconnected）"
    },
    "method": {
      "recommended": "python-requests",
      "auth_required": false,
      "rate_limit": "历史K线API频繁返回Max retries exceeded",
      "encoding": "utf-8",
      "user_agent_required": false
    },
    "response": {
      "format": "json",
      "structure_hint": "pandas DataFrame"
    },
    "domains": [
      "stock"
    ],
    "known_issues": [
      "get_quote_history() 底层走东方财富 push2his.eastmoney.com，2026年5月起限流严重",
      "get_realtime_quotes(fs='沪深A股') 获取全市场股票列表仍可用（约5529只）",
      "需要 pip install efinance --break-system-packages"
    ],
    "alternatives": [
      "tencent-finance-api",
      "tencent-finance-historical",
      "sina-finance-api"
    ]
  },
  {
    "id": "sina-finance-api",
    "name": "Sina Finance API",
    "name_cn": "新浪财经 API",
    "url": "https://vip.stock.finance.sina.com.cn/quotes_service/api_json_v2.php/Market_Center.getHQNodeData",
    "type": "json-api",
    "accessibility": {
      "status": "verified-working",
      "last_verified": "2026-05-20",
      "verified_by": "qypvip",
      "notes": "支持分页和条件筛选，可用于选股扫描"
    },
    "method": {
      "recommended": "curl",
      "auth_required": false,
      "rate_limit": "未知",
      "encoding": "gbk",
      "user_agent_required": false
    },
    "response": {
      "format": "json",
      "structure_hint": "返回股票列表JSON，支持node=sh_a/sz_a 参数"
    },
    "domains": [
      "stock"
    ],
    "known_issues": [
      "排序和筛选参数需要摸索",
      "GBK编码"
    ],
    "alternatives": [
      "tencent-finance-api",
      "efinance-package"
    ]
  },
  {
    "id": "sunshine-gaokao",
    "name": "Sunshine Gaokao (阳光高考网)",
    "name_cn": "阳光高考网",
    "url": "https://gaokao.chsi.com.cn",
    "type": "waf-blocked",
    "accessibility": {
      "status": "verified-broken",
      "last_verified": "2026-05-20",
      "verified_by": "qypvip",
      "notes": "阿里云WAF防护，curl返回412，headless浏览器也无法通过。最权威的官方数据但不可爬取。"
    },
    "method": {
      "recommended": "not-available",
      "auth_required": true,
      "rate_limit": "N/A",
      "encoding": "utf-8"
    },
    "response": {
      "format": "html",
      "structure_hint": "N/A - blocked by WAF"
    },
    "domains": [
      "gaokao"
    ],
    "known_issues": [
      "阿里云WAF返回412状态码",
      "CDP浏览器也无法绕过",
      "建议直接使用训练知识或官方PDF"
    ],
    "alternatives": [
      "bing-search-cdp",
      "gaokao-quark"
    ]
  },
  {
    "id": "gaokao-quark",
    "name": "Quark Gaokao (夸克高考)",
    "name_cn": "夸克高考",
    "url": "https://gaokao.quark.cn",
    "type": "spa",
    "accessibility": {
      "status": "partial",
      "last_verified": "2026-05-20",
      "verified_by": "qypvip",
      "notes": "Quark App内嵌SPA，浏览器访问会弹出下载弹窗。有完整数据（含冲稳保推荐和各校录取位次）但accessibility tree抓不全。"
    },
    "method": {
      "recommended": "cdp-browser",
      "auth_required": true,
      "rate_limit": "未知",
      "encoding": "utf-8",
      "user_agent_required": true
    },
    "response": {
      "format": "spa",
      "structure_hint": "JS动态渲染，accessibility tree可能为空"
    },
    "domains": [
      "gaokao"
    ],
    "known_issues": [
      "弹出'下载夸克PC端'弹窗需手动关闭",
      "省份切换影响真题页面但不影响考生数据",
      "子域名vt.quark.cn返回空页面",
      "手动操作比自动化更高效，适合截图/手动记录"
    ],
    "alternatives": [
      "bing-search-cdp",
      "sunshine-gaokao"
    ]
  },
  {
    "id": "bing-search-cdp",
    "name": "Bing Search (via CDP Browser)",
    "name_cn": "必应搜索（CDP浏览器）",
    "url": "https://cn.bing.com",
    "type": "cdp-required",
    "accessibility": {
      "status": "verified-working",
      "last_verified": "2026-05-20",
      "verified_by": "qypvip",
      "notes": "中国网络环境下唯一可用的搜索引擎。国内版(cn.bing.com)可通过CDP浏览器正常访问，无验证码。"
    },
    "method": {
      "recommended": "cdp-browser",
      "auth_required": false,
      "rate_limit": "少量，正常搜索频率",
      "encoding": "utf-8",
      "user_agent_required": false
    },
    "response": {
      "format": "html",
      "structure_hint": "搜索结果页，链接可直接访问"
    },
    "domains": [
      "gaokao",
      "football",
      "stock",
      "sports-tournament",
      "general"
    ],
    "known_issues": [
      "无法curl获取（返回验证码/拦截）",
      "需要用CDP浏览器打开才能正常访问",
      "国内版搜索结果可能不如国际版全面",
      "用完CDP浏览器后需要主动关闭（停止Edge进程+取消cronjob）"
    ],
    "alternatives": [
      "baidu-search-cdp",
      "google-search-cdp"
    ]
  },
  {
    "id": "baidu-baike",
    "name": "Baidu Baike (百度百科)",
    "name_cn": "百度百科",
    "url": "https://baike.baidu.com",
    "type": "behind-captcha",
    "accessibility": {
      "status": "verified-broken",